{
  "id": "super_bouncy",
  "name": "Super Bouncy",
  "version": "1.0.0",
  "author": "Marble Game Team",
  "rarity": "common",
  "appearance": {
    "color": {
      "r": 1,
      "g": 0,
      "b": 0.8
    },
    "roughness": 0.2,
    "emissive": {
      "r": 1,
      "g": 0,
      "b": 0.8,
      "intensity": 1
    }
  },
  "physics": {
    "radius": 0.52,
    "density": 0.5,
    "friction": 0.5,
    "restitution": 1.5
  }
}
