{
  "id": "ethereal_juggernaut",
  "name": "Ethereal Juggernaut",
  "version": "1.0.0",
  "author": "Marble Game Team",
  "rarity": "common",
  "appearance": {
    "color": {
      "r": 0,
      "g": 1,
      "b": 0.5
    },
    "emissive": {
      "r": 0,
      "g": 1,
      "b": 0.5,
      "intensity": 5.5
    },
    "clearCoat": 1,
    "clearCoatRoughness": 0,
    "materialType": "glass"
  },
  "physics": {
    "radius": 0.8,
    "density": 25,
    "friction": 0,
    "restitution": 1.2
  }
}
