{
  "id": "celestial_orb",
  "name": "Celestial Orb",
  "version": "1.0.0",
  "author": "Marble Game Team",
  "rarity": "legendary",
  "premium": true,
  "unlock": "premium",
  "appearance": {
    "color": {
      "r": 0.3,
      "g": 0.7,
      "b": 1
    },
    "roughness": 0.05,
    "emissive": {
      "r": 0.5,
      "g": 0,
      "b": 1,
      "intensity": 3
    }
  },
  "physics": {
    "radius": 0.6,
    "density": 1.5,
    "friction": 0.1,
    "restitution": 0.8,
    "gravityScale": 0.8
  }
}
