{
  "id": "abyssal_eye",
  "name": "Abyssal Eye",
  "version": "1.0.0",
  "author": "Marble Game Team",
  "rarity": "legendary",
  "premium": true,
  "unlock": "premium",
  "appearance": {
    "color": {
      "r": 0.1,
      "g": 0,
      "b": 0.2
    },
    "roughness": 0,
    "emissive": {
      "r": 0.3,
      "g": 0,
      "b": 0.8,
      "intensity": 6
    }
  },
  "physics": {
    "radius": 0.55,
    "density": 5,
    "friction": 0.8,
    "restitution": 0.2,
    "gravityScale": 1.5
  }
}
