{
  "id": "ice_slick",
  "name": "Ice Slick",
  "version": "1.0.0",
  "author": "Marble Game Team",
  "rarity": "common",
  "appearance": {
    "color": {
      "r": 0.8,
      "g": 0.9,
      "b": 1
    },
    "roughness": 0.05,
    "materialType": "glass"
  },
  "physics": {
    "radius": 0.48,
    "density": 0.9,
    "friction": 0.005,
    "restitution": 0.8
  }
}
