{
  "id": "ghost",
  "name": "Ghost",
  "version": "1.0.0",
  "author": "Marble Game Team",
  "rarity": "common",
  "appearance": {
    "color": {
      "r": 0.9,
      "g": 1,
      "b": 1
    },
    "thickness": 0.25,
    "materialType": "classicGlass",
    "emissive": {
      "r": 0.9,
      "g": 1,
      "b": 1,
      "intensity": 1
    },
    "shader": {
      "fresnelStrength": 0.75,
      "chromaticDispersion": 1.1
    }
  },
  "physics": {
    "radius": 0.5,
    "density": 0.1,
    "friction": 0.05,
    "gravityScale": 0.2
  }
}
